challenge_buffet__curse__bane_of_midas__name,"Bane of Midas",,,,,,,,,,,,
challenge_buffet__curse__bane_of_midas__desc,"You are cursed: gold is deadly and must be avoided",,,,,,,,,,,,
challenge_buffet__curse__heartbreak__name,"Heartbreak",,,,,,,,,,,,
challenge_buffet__curse__heartbreak__desc,"You are cursed: maximum health cannot be increased",,,,,,,,,,,,
challenge_buffet__curse__mortality__name,"Mortality",,,,,,,,,,,,
challenge_buffet__curse__mortality__desc,"You are cursed: take damage to maximum health",,,,,,,,,,,,
